{
  "contractVersion": "1.0.0",
  "effectId": "effect_01K2B",
  "semanticEffectSlot": "create-order",
  "semanticEffectKey": "effect-key:create-order:8ea7",
  "rootRunId": "run_01K2A",
  "runId": "run_01K2A",
  "activityRunId": "activity_run_create_order_01",
  "activityAttemptId": "activity_attempt_create_order_02",
  "executionScopePath": "run_01K2A/create-order",
  "kind": "tool.invoke",
  "toolRef": "purchase-order.create@4.2.1",
  "impact": {
    "determinism": "externally_determined",
    "dataAccess": "write",
    "mutation": "irreversible",
    "externality": "external_service",
    "compensability": "mitigatable"
  },
  "inputDigest": "sha256:6666666666666666666666666666666666666666666666666666666666666666",
  "authorityScopeDigest": "sha256:7777777777777777777777777777777777777777777777777777777777777777",
  "idempotencyKey": "tenant_acme_eu/effect/effect-key:create-order:8ea7",
  "reconciliationPolicyRef": "purchase-order-reconcile@2.0.0",
  "compensationPolicyRef": "purchase-order-cancel@1.0.0",
  "capabilityGrantRef": "capability_grant_01K2G",
  "policyDecisionRefs": ["policy_decision_01K2P"],
  "approvalIds": ["approval_01K2C"],
  "status": "outcome_unknown",
  "invocationIds": ["invocation_01K2I1", "invocation_01K2I2"]
}
